word,success,wrong_guesses,repeated_guesses,num_steps,guesses_seq
tenontomyoplasty,1,4,0,15,s t i e r a o n u l h m y p
sam,0,6,0,9,a l t r n m b h
animus,0,6,0,11,a l n e o i c s t d
cove,0,6,0,9,a s e p i u o m
sigmund,0,6,0,11,a s e i n t g o r l
sarmatier,1,5,0,13,s t i n a b c l r o e m
sardanapalus,0,6,0,9,s e i t h c u o
hyoid,0,6,0,8,a s e u o r l
faburden,0,6,0,11,a n r i e p t l c s
rerise,1,2,0,7,a s t e r i
nasoprognathic,1,2,0,14,s t i c e p h a r o n u g
retroreception,0,6,0,14,s a p o n e r h i t d l m
unoffendable,0,6,0,14,s a l e n t d i g o r u m
nonapparent,0,6,0,12,s a t l n r c i e b m
colalgia,0,6,0,12,a r s l e i p c o t d
oncosphere,0,6,0,13,s t e h p r i c a u m d
adiposuria,0,6,0,11,s e t i c n a o h m
musculofibrous,0,6,0,14,s e t p c a o r n u l m g
morglay,0,6,0,10,a n l r s e t c p
incompactly,1,4,0,15,s a t e i n o r u l y m c p
anastate,1,1,0,7,a t i e n s
upwind,0,6,0,10,a s e u n g t i l
unrebel,0,6,0,12,a s e r c n d l u t m
gam,0,6,0,9,a l t r n m b h
psychophysical,0,6,0,15,s t i n c o r a l u m p h e
fathomlessness,0,6,0,15,s e t o n m p c a i r h b d
bronchiectatic,0,6,0,13,s a l t e i c p u h m d
otiatrics,1,5,0,13,s a l c n t i r u p e o
litopterna,1,3,0,13,s a p h l e r i n c t o
witeless,0,6,0,12,a s e l o i t p m d h
ceratospongian,1,4,0,16,s t e r a n i h c u o d g m p
pungle,0,6,0,11,a s e u l n c d r b
osmetic,0,6,0,13,a s i n o t c e b d f g
undisintegrated,1,3,0,14,s t e n d r i a u p o c g
pronunciative,1,4,0,16,s a t i p o n c l d r e v g u
tartly,1,4,0,10,a l e y t n s c r
abatua,0,6,0,9,a n l t h r i c
playock,0,6,0,11,a l n t r c o h e i
adaw,0,6,0,8,a n r l s g t
unrightful,0,6,0,13,s a e o i n t h u l c d
overelegancy,0,6,0,14,s a l e t r n c o h i u k
beplaided,0,6,0,11,s a n t r l d p c u
denotement,0,6,0,11,s a e r n t d l i c
semipermanent,0,6,0,15,s t e n r a d l m i v c z g
diaphaneity,1,5,0,15,s a l t r n e i o h y p m d
tyronism,1,5,0,14,a s e i t h r o u c m n y
invulnerableness,0,6,0,16,s e n r i a t l g o d c u b q
glycolyl,0,6,0,8,a s e i o p n
metasedimentary,1,2,0,13,s t i e r a o n d c m y
wingseed,0,6,0,10,a s e d c l r p u
threnetical,1,3,0,13,s a l c p i o t e r n h
noncompetitively,1,5,0,17,s a e r n t i d o l y u m c v p
unimpressionability,1,3,0,18,s i n c t e a o r l h d u y m p b
ecorticate,1,4,0,12,s a t e l r i n d c o
waird,0,6,0,11,a l n r i e y d p c
angelocracy,1,5,0,15,s a n t g l e i y o r p u c
subregent,0,6,0,10,s t e m o i h c a
popshop,1,5,0,10,a s e i t m p h o
semisubterranean,0,6,0,16,s t i e r a l n h c u d m p o
mycophyte,1,4,0,13,s a e i p o h y l m t c
sturdiness,1,2,0,11,s e i t u n m l r d
liquorless,0,6,0,14,s e n r l u i t c o f d a
bowwort,0,6,0,8,a s e u i o n
oculinidae,0,6,0,12,s a l i n c t r b m p
backstone,0,6,0,14,s t e i o n r a d l c p m
omnipercipient,1,3,0,13,s a p e r i n t c u m o
bitterbark,0,6,0,12,s a t e r i o m y d c
incessably,1,1,0,11,s e c a t n l i y b
baloskion,0,6,0,13,s t e a n l i o m p c h
gummy,0,6,0,8,a s e u n r l
resinophore,0,6,0,13,s t e i n g a o r u l m
jinni,0,6,0,8,a s e u o i c
preseal,0,6,0,11,a n l s t m b o p h
cryptorrhetic,0,6,0,15,s a c o n r e i t y m d p v
dolorific,0,6,0,10,s a e c p i t o n
strumpet,1,5,0,13,a s e r i o n t y m p u
rebegin,0,6,0,10,a s e r n d l t m
trapping,0,6,0,13,a t r l n e c i g s b m
unwarpable,0,6,0,14,s a n l e t b u m g r i c
revolutionist,0,6,0,16,s e t i n r l o u a b c d f g
unconduciveness,1,3,0,13,s e n t i a g o c d u v
blunthearted,0,6,0,16,s a t i e r n p c d u h m b o
pelotherapy,1,5,0,15,s a t e r n l c p h o i u y
amiidae,0,6,0,8,a n l r t s c
sclerification,1,4,0,16,s t i n c o a h e r l d v m f
myoglobulin,0,6,0,10,s a e c i o n r p
fragmentize,0,6,0,12,s a t i n r c l d o p
interjacent,0,6,0,14,s a t e r p c u m i n d o
catoptrically,1,4,0,14,s a l i c e t o y n r u p
aphlebia,0,6,0,12,a n l i e t r c s b m
nonsaponifiable,0,6,0,16,s t i c n a l e r b m d p o v
caconym,0,6,0,11,a l n e i c t o g d
choletherapy,0,6,0,16,s a t e r l n c o b h m p i u
unlauded,0,6,0,11,a t n l r u s m b p
outraging,0,6,0,14,s a n t e i c g p u r q b
groaning,0,6,0,12,a t n e i s c p g r m
woodstone,0,6,0,12,s t e i o n r p u c m
unshapeliness,1,4,0,14,s e t r p c a n d l i u h
overboldly,0,6,0,12,s a e r o v u m b w n
entoptoscope,1,4,0,12,s e t i o n r m p h c
delft,0,6,0,9,a s e r n l o y
semioxidated,0,6,0,15,s t e a m i n r c d o l p g
hydrazide,0,6,0,9,s a n t r c l u
visitation,0,6,0,13,s t i n a o p m d h b r
trinucleate,0,6,0,14,s a t e i n g o d c h r k
polyphosphoric,1,4,0,14,s t e p h o n r i c u l y
ustilago,0,6,0,12,a t e i n c l s r b p
larithmics,0,6,0,15,s u e i c n a t r o h p m b
overeyebrowed,0,6,0,11,s a c e r o n l d t
nonparasitic,0,6,0,15,s e t i o l n c g a r d f m
ironsided,1,1,0,9,s t e r i o n d
autocratically,1,4,0,14,s a l t i e o n r y c p u
benzohydrol,0,6,0,12,s a e r i o n u l p m
tergiversant,0,6,0,15,s t i e r c h m u o a n v d
presbytia,0,6,0,13,s e p t i n c a h u o m
porencephalon,1,5,0,15,s a l i e n p h o t g d r c
mullerian,0,6,0,14,s a n i r e p c l g u q b
photoengraving,0,6,0,17,s a t i n e c g p h r l o b m d
recrescence,1,3,0,9,s e r n t d g c
copepoda,0,6,0,10,a s c i h r u o n
unphysicked,1,5,0,17,s e r n t o i c a d g h u k y p
progressive,0,6,0,12,s i n c p t a o r d l
unspayed,0,6,0,12,a l r t n e d i u b g
moxieberry,0,6,0,12,s a e r o u n i t m d
thoughtlessly,0,6,0,13,s e t i h o n r u c p a
abhorson,0,6,0,13,a n t r e i o l c s b j
antitype,0,6,0,13,a n e t y p b c d f g h
preadministrative,1,3,0,15,s t i n a r c l d o p m v e
griff,0,6,0,8,a s e u o i t
patination,1,1,0,8,s a t i n o p
nullibility,0,6,0,9,s a e c i t r o
burgall,0,6,0,9,a t r e c d n m
timekeepership,0,6,0,12,s t e i n c d a l r o
spinipetal,0,6,0,14,s t i e o r a n l c v d m
counterirritate,1,3,0,13,s a t i e c o n d l r u
xanthydrol,0,6,0,15,s a t e i o r n u l h y p c
reefer,0,6,0,9,a s e r l n d t
antitwilight,0,6,0,12,s a t i n c o l d r m
ostraciidae,1,4,0,14,s t e i a r l n c u p d o
brachyglossal,0,6,0,14,s e a t l n c o h i p y u
gozell,0,6,0,9,a s e r n l p c
molding,0,6,0,10,a s e u i n g p c
serosanguinolent,1,3,0,15,s t i c n e a r g o l h m u
pixilated,0,6,0,13,s a l t e n d c u p h r
greatish,0,6,0,14,a t e r i n c s h p u b o
duskiness,0,6,0,12,s e i n u t h m c p q
intrapsychical,1,3,0,15,s t e i a n l c h r u o p y
myrmicidae,0,6,0,12,s a l n r e i c p t u
tetraplous,1,4,0,14,s u a c r t l i e b o g p
unstateable,1,2,0,11,s t i e r n a l u b
unracked,1,5,0,14,a t n l r d u e m i c h k
jocund,0,6,0,10,a s e u n g i o h
fluoborid,0,6,0,9,s a e c p i o n
unforgiven,1,5,0,15,s a e r n i t g o c d u v f
