word,success,wrong_guesses,repeated_guesses,num_steps,guesses_seq
epiboulangerite,0,6,0,18,s a t i n e c d r o l g p u z m f
mahdist,0,6,0,12,a l n t r s d i f p c
eileen,0,6,0,10,a s e r n d l b p
regild,0,6,0,11,a s e r n l i t m v
vesicocervical,0,6,0,15,s t e r i n c o a l p m d h
henotheistic,1,2,0,11,s t i c a e r n h o
sixpenny,0,6,0,11,a s e r n t i c o d
fifteenfold,0,6,0,12,s a e n u t c i g o r
sapucainha,0,6,0,12,s t e i c a n l r b g
campaign,0,6,0,12,a l r t n c s b m p d
shebat,0,6,0,11,a n l r s y t i e m
nonextraneous,1,4,0,14,s e n r d a l t c m o u x
questionee,1,3,0,12,s t e i c n p a u o q
batino,0,6,0,10,a l n g e c s b d
sibilatingly,0,6,0,15,s t e i n c a g r l y d v m
purposiveness,1,5,0,15,s e t i n u l r a o c v m p
contaminant,1,4,0,12,s a t n l c r b m o i
dinghee,0,6,0,8,a s e c p r u
dressmakery,0,6,0,13,s e t r i a o m y l n p
undertide,1,3,0,11,s a e r i n t v d u
cam,0,6,0,9,a l t r n m b h
expositionary,1,4,0,16,s t i c n e r a o d l m y p x
geomagnetist,0,6,0,14,s e r t i m a l n p d c h
hydrophyton,0,6,0,14,s a e c i p h o r y n t g
isosaccharin,1,4,0,13,s t i n e u h o a l r c
deathless,1,5,0,13,s e r n l a c v h b d t
bowenite,0,6,0,11,a s e r n i t l u p
untruck,0,6,0,10,a s e u n o r g l
crossfoot,0,6,0,12,s e a i t p c o h r m
geniolatry,0,6,0,16,s a l r o t i e m d y p n c h
antilabor,1,3,0,12,s a t r i c n l b e o
myxomycetales,0,6,0,14,s e c r n p a t u m i o b
unattuned,1,5,0,12,s a n c t e r d i o u
raash,0,6,0,10,a l n t r c s i e
genesiology,0,6,0,12,s t e i n c a o r m p
renunciator,1,3,0,13,s a l t e r c n o i g u
stimulus,0,6,0,11,a s e t i n c o l d
unusurping,0,6,0,12,s t e a i n o c g u l
incontinently,1,4,0,13,s a c e n t i o r h y l
recurse,0,6,0,10,a s t e r m n d l
submarshal,0,6,0,14,s i t e h o a l u n r m g
contemnibly,0,6,0,16,s a e r n t c i o l m b d f g
oppressor,1,1,0,7,s e p o n r
commencer,1,4,0,11,s a e r n c o u l m
inductively,1,4,0,15,s a e n t i c r d l y v o u
heterosporic,1,2,0,12,s e t r i n c h o m p
sabbathize,0,6,0,13,s t i e h p c u o a n l
awabakal,0,6,0,10,a l r t n c m b p
hercogamy,0,6,0,13,s a t r e o n l c m i p
palluites,0,6,0,14,s a n l e i c t p o d v y
unghostlike,0,6,0,16,s e t a i p c u n g r l o v d
obstructingly,1,3,0,16,s t i n e a o r g l y u p c b
maxillojugal,0,6,0,12,s a l e i y o n r m t
reproductive,1,4,0,15,s a e r i o n l u t c d v p
stereographically,1,3,0,17,s t e r a n l i c o y b p h u g
cacumination,1,5,0,14,s a n c t e i o h r u l m
mormonite,1,2,0,10,s a e i t r o m n
phobos,0,6,0,10,a s u i e o m p r
counterorator,1,4,0,13,s a l n t i e r p c o u
jumblement,0,6,0,14,s a e r n t m p u b l c d
jusquaboutist,0,6,0,11,s t i p c e u n l r
unconcertedness,1,3,0,13,s e n t i a g o u d c r
engrossingly,1,2,0,12,s e t r n i a o g l y
turniplike,0,6,0,14,s a e p o r i c t h n l v
polyphagic,0,6,0,15,s a l e i n o c y p r t h b
halfpenny,0,6,0,13,s a n e t l i o y u p c
scoter,1,3,0,10,a s e r t i h c o
shellum,0,6,0,10,a s e r t l d i y
zafree,0,6,0,10,a l n r e m t p c
orange,0,6,0,12,a r n i e t g p u c b
scrutation,1,3,0,13,s t a i n o u l e h c r
nonsolvency,0,6,0,12,s t e p c i o n r a h
lichenographer,0,6,0,16,s a t r p h e n c i g d m b f
pestilence,1,5,0,14,s t i n c a o h e v d p l
homalopsinae,0,6,0,15,s e i n p c t a l u m d b r
ermani,1,2,0,9,a t n e r g i m
mellisugent,0,6,0,15,s e r n t i c a m l h u p d
plugdrawer,0,6,0,12,s a l e r i y o t u n
homoplasis,1,2,0,11,s i a p o r h l n m
developability,0,6,0,15,s a t i e r n o h l m y d c
regreet,0,6,0,10,a s e n r d t p o
zygomycete,0,6,0,10,s a e r c o n p u
barrow,0,6,0,11,a l n r e o c w h y
papilioninae,0,6,0,11,s a l i n t r c b m
resident,0,6,0,13,a s e t i n d p m c h v
leptothrix,0,6,0,14,s a e r i c n t o d l p v
animalize,0,6,0,12,s a t r l e i n c v d
nonacosane,1,5,0,12,s i e t u a n l r c o
translucence,0,6,0,15,s t i e r a n h c u q o m p
pedological,1,3,0,13,s a l i o c g p e n r d
phototropism,1,4,0,13,s e t i a o p h c u m r
lory,0,6,0,10,a s e u o n r y t
monodynamism,0,6,0,13,s e t i m a o n r u l p
untaintedness,1,4,0,13,s e n d t i u r h o l a
congoleum,0,6,0,13,s a e r n c t d o l m i
orthosilicate,1,2,0,13,s t i e a r o n c h d l
flocculate,0,6,0,13,s a t e c o h u p m r b
nonsanctification,1,4,0,13,s t i c n a o d l v m f
incurability,1,5,0,16,s a t i l r e n o g h c y b u
sultan,1,4,0,11,a n s e i m l y u t
equilibrium,0,6,0,12,s a e r i l b z n c t
hath,1,2,0,6,a t e i h
xiphiidae,0,6,0,13,s a n l r t d i p h e z
ambay,0,6,0,8,a l n s r p t
chaetotactic,1,4,0,12,s a n l r t i c h e o
copter,0,6,0,11,a s e r p i c u h l
prejudicative,0,6,0,16,s a t i n c e r d l p m v o x
lindane,1,4,0,11,a t r l e i n g c d
gastrolatrous,0,6,0,12,s e t i a o r m n p c
vitelline,0,6,0,10,s a e r t n u p c
sulfarsenite,0,6,0,16,s e t r n i h c u l a y m o d
mesolabe,0,6,0,10,a t r l n s c p u
staphylomatous,0,6,0,14,s e i t o r n u a l c m b
unqualified,0,6,0,14,s a t n e d l i g o c u v
iridencleisis,0,6,0,14,s i n t c o a h e l d v m
zoolithic,0,6,0,10,s a e c p i n t u
jahvist,0,6,0,10,a l n t r s d c e
shucking,0,6,0,12,a s e i n t g o h r l
patronizable,1,4,0,16,s a l i c e n t r o b m p d z
reservor,0,6,0,11,a s e r i o c t m d
omniparent,0,6,0,15,s a t n e o i l c r u m d z
beaverette,0,6,0,11,s a t i e r l n p m
bugleweed,0,6,0,10,s a e d h p c u n
heptahedron,0,6,0,12,s a t n p l c r u b m
geniture,0,6,0,12,a s e r d t n o p i h
birminghamize,0,6,0,14,s a t r e c i n g l d m v
odeum,0,6,0,8,a s e r n l t
magnetometric,1,2,0,13,s a t i n e o c r m u g
hyloid,0,6,0,8,a s e u o n r
combfish,0,6,0,11,a s e i t h p o l n
unmended,0,6,0,11,a s e r n d t u g c
caravan,0,6,0,11,a n l r s c t m b p
napkining,0,6,0,10,s a n t e l i c r
unfrosty,0,6,0,14,a s e i o u n t r h y g c
corejoice,0,6,0,10,s a e r n c d t l
anchises,1,5,0,13,a n e s l t i g o d c h
bastardism,0,6,0,12,s i t a l n c r e h p
submissively,0,6,0,10,s c a t i n o e r
illegitimacy,0,6,0,13,s a t e r n i c o h l u
macronutrient,1,3,0,14,s a t c e i o n h r p m u
unexplainableness,0,6,0,16,s e n r t a l d c m u p b i o
subdeanery,0,6,0,13,s t e r i a o c m u n l
concurso,1,5,0,12,a s e i u t p c o n r
desmarestiaceous,1,4,0,16,s i n t c a l r o p u h m e d
undermoral,0,6,0,14,s a l c t p i e r o u n g
underbear,0,6,0,13,s a n t l d e r u m v i
struggle,0,6,0,12,a s e i t o r y m u n
perjuriousness,0,6,0,15,s e n t r a i o u p c m b d
gruelly,0,6,0,12,a s e r l y u c p t b
slavophobe,0,6,0,12,s t e i a c l n r b m
cyanoacetate,0,6,0,12,s a t r l n i e p c h
micropterus,1,2,0,13,s a u o p r h e c t m i
placean,0,6,0,11,a n l c i h b u r t
functionalism,1,5,0,17,s e t i a n c u o m r l q p b f
portraitlike,0,6,0,15,s a t e i p h r n o c v l d
pinacoceras,1,3,0,13,s a t n l c o h e p r i
sericiculturist,1,4,0,13,s e t r i n c o a h u l
statuecraft,0,6,0,14,s t i e r a n h c l u p x
uncaptained,1,3,0,13,s a t n e r d u i c l p
orgiastical,0,6,0,13,s e i c a t n l p u m d
multicipital,0,6,0,14,s a l i c p u n t q b f o
surfacely,0,6,0,14,s t e r a n l i y c o p m
chairless,0,6,0,14,s e a l r t p c h b g u d
enlodge,0,6,0,11,a s e n o r u l m p
gravimetrical,0,6,0,15,s a n l r t e i c p d v z u
sufferer,0,6,0,10,a s e r i k t h c
overdance,0,6,0,12,s a l t n c e r p u m
ko,0,6,0,8,a p u o h r d
gematrical,0,6,0,14,s a n l t i p c u r m d b
turbot,0,6,0,9,a s e u n l r i
apogon,0,6,0,9,a l n t r s d c
graphis,0,6,0,9,a l r t n c e b
holomyaria,0,6,0,12,s a r i c u e o n m p
phenanthroline,1,2,0,13,s a t i c n e r o p h l
patavinity,0,6,0,10,s a t i e r o h l
continuingly,0,6,0,15,s a e c o n t i g r l y d f
cholemia,1,5,0,14,a s c i o r n l e h d t m
blessedness,0,6,0,10,s t p c i e r n a
reaggregation,0,6,0,13,s a t i n r e l c b m p
unsharedness,0,6,0,14,s e n u a t h p v k l r o
leanness,1,2,0,8,a t l n e r s
disinsulation,1,5,0,15,s t i n e h o c p u l a m d
viosterol,0,6,0,14,s e r i t a o n m l p d h
configural,1,4,0,15,s a l c o n e i d t g r u f
reinvestigate,0,6,0,15,s t i n e c a d g p v m h b
indiction,1,3,0,10,s a e c o n i t d
unfasten,0,6,0,13,a t e r n s f b c d g h
anastomosis,1,3,0,11,s i a t e r o l n m
thatchy,0,6,0,9,a l r n s t i e
intercalate,1,2,0,11,s a t i e r n l m c
entrainment,0,6,0,13,s a t n e i r g d c v k
upend,0,6,0,10,a s e r n c p t i
gaslight,0,6,0,12,a n l e i t g b u r o
notewise,0,6,0,11,a s e r t n d l c m
butenyl,0,6,0,11,a s e r n t u i g o
philopatrian,1,2,0,12,s a l i t e n o p h r
daedalist,1,5,0,13,s e r t c a l i m p n d
littleleaf,0,6,0,12,s a l e i n t r c b m
leveret,0,6,0,10,a s e r d f n t p
oneism,0,6,0,10,a s t e c m p u d
aftercourse,0,6,0,15,s t i e r a o n p c u l x b
shoother,1,3,0,10,a s e r t i u h o
putrefiable,0,6,0,15,s a l e n p r h o i t d b m
fellingbird,0,6,0,14,s a e r o i n t d c g l p
zain,0,6,0,10,a t n i p h d w l
aberration,1,3,0,12,s a t i n r l c b e o
bellpull,0,6,0,9,a s e r n l i y
tzotzil,0,6,0,8,a s e u i c n
hartal,0,6,0,10,a n l r p b m c i
ricinolein,1,5,0,13,s a e r n i t g o l d c
exercitorial,0,6,0,15,s a l c e o r h t i n d m v
diastolic,0,6,0,13,s e a t i c d b f g h j
steerswoman,0,6,0,15,s t i e h u c o n r m a p l
biguttate,0,6,0,11,s a t i e n c o d l
antisyndicalist,0,6,0,12,s t i c a e h u p m o
assistful,0,6,0,12,s t i e o a r h y u n
snowk,0,6,0,11,a s e t o n d w y i
adnephrine,0,6,0,13,s a t n e r d l o i m c
moldableness,0,6,0,15,s e a l b n u o v i c p m y
indices,1,5,0,12,a s u e c p t m d i n
deconcatenate,1,4,0,12,s a t i e r n d l c o
colima,0,6,0,11,a s c o r n m b d e
pyralid,0,6,0,11,a t n l e i c s p o
apio,0,6,0,8,a l n r t s e
solely,1,5,0,11,a s e r t i l y u o
influxable,0,6,0,14,s a l i e n y o u r b m g
laceration,1,3,0,13,s a t i n l m p r c o e
unapart,0,6,0,10,a l r i o e s p c
capacity,0,6,0,11,a t i e r l o h y n
supercynical,1,5,0,17,s t e r i a l o c h u k n m p y
acuminose,1,4,0,14,s e a t l n r c o h i u m
underwent,0,6,0,13,s a e r t n u v d m i c
orangite,0,6,0,13,a t e c s r b p l n i d
prehensible,0,6,0,13,s e p r u t i n c a o d
anthelion,1,4,0,13,s a t i n o u e r h d l
deinotherium,1,4,0,15,s a e r o n i c t d l m h u
circumambulator,1,4,0,15,s a l t i n e r o c h u m b
serment,1,2,0,9,a s e r v n t m
malleoincudal,1,5,0,16,s a l e r n t d i g o c p m u
neckline,0,6,0,11,a s e r n d l t i m
securigera,0,6,0,13,s t e r a o i n d l c v
instantaneously,1,3,0,14,s t i e r a n c m l o y u
genys,0,6,0,9,a s u e r l t m
aggrievedly,0,6,0,14,s a t l e i n r y c b d m
coburghership,0,6,0,14,s i c o n r a t e l m u d
labioalveolar,0,6,0,14,s a l t n e r c b i d v m
sagaie,0,6,0,8,a n t r l c m
schistosoma,1,2,0,11,s o t m e i a h p c
overplay,0,6,0,11,a n l r t s c p b m
heterosporium,1,5,0,16,s t e r i n c a o d l p m h u
manumission,0,6,0,12,s i n t e a o g c d p
benn,0,6,0,9,a s e r n p t m
damlike,0,6,0,13,a l i n s t e k w m p c
conservatize,1,3,0,15,s t e r i a p c o n v d l z
amphipleura,0,6,0,14,s a l i e r t n c b p h d
multivorous,0,6,0,14,s a u r n l e i c t o p f
dulcet,0,6,0,9,a s e r n d o i
sanction,0,6,0,13,a n i g t o c p m r b h
unterrifiable,0,6,0,16,s a l e r i p c t u n b d v m
formerly,0,6,0,12,a s e r o t c i m y p
epirotulian,1,5,0,16,s a l n p h e r i o u m g c t
asymmetron,1,5,0,15,s t e i o n h u c a p m r y
emulgent,0,6,0,12,a s e r n t d l m i o
unfeatured,0,6,0,14,s a n e d l u t g r c v k
plantae,1,3,0,10,a n l t p b c d e
aseptify,0,6,0,14,a n t e s p b c d f i o u
hydrogenide,0,6,0,13,s a e r i t o n d p c u
hypotonia,1,2,0,11,s a p h o n r t i y
homolysin,0,6,0,14,s e i a o n r m p l c h u
hurdis,0,6,0,11,a s u l r e c i t m
undermist,1,4,0,14,s e t r a o i n b c d u m
swainishness,0,6,0,13,s e i t h c u a n m p l
condiment,0,6,0,14,s a e r n t c i o b d v l
proctoparalysis,1,4,0,15,s p h e r a i t n l o u y c
kryokonite,0,6,0,13,s a e p i t c r o n m l
unpunishably,1,5,0,16,s e t c i p h a r l o u y n b
chamfer,0,6,0,12,a l r t c e h n p i k
periconchitis,1,0,0,11,s e r i t p n c o h
neopallium,1,5,0,15,s a n t e r l i c d o m p u
coenosarcous,1,3,0,12,s i o t n e c u h a r
populicide,0,6,0,12,s a e p i h r o l n t
sphingal,1,3,0,12,a n t l e s i p r h g
repugner,0,6,0,10,a s e r t l n c d
waterboard,0,6,0,12,s a t e r i o m c y p
pseudocumenyl,0,6,0,13,s t i e r n a d o g c h
retrace,1,0,0,6,a t r c e
condensation,1,2,0,12,s e i n t p c o g d a
backcourt,0,6,0,12,s a n l t r e c o p i
daff,0,6,0,8,a t n l r c b
banderole,0,6,0,13,s a n e r i o t g m d p
hawaiite,0,6,0,11,a t i e r l c m p n
polymerous,1,3,0,13,s u a o n r i m p l e y
stickadore,0,6,0,15,s t e i n l a m c r b p d h
cameography,1,5,0,16,s a l t r g p h i e o y n c m
unsacrificeable,1,4,0,16,s t e r a i n l c u b d v m f
lim,0,6,0,7,a u p e o s
dravya,0,6,0,9,a r t n m l c s
demosthenic,1,3,0,14,s t i e n r c d l a m h o
isoeugenol,0,6,0,13,s t i e r n a d c o l m
flourish,0,6,0,12,a s e i t h p o l b n
toxicological,0,6,0,10,s a l o n r u m p
cantabrian,1,4,0,12,s a n t l r c i e p b
woodbine,0,6,0,10,a s e i t n c r l
ossetine,1,3,0,10,a s t i n e u p o
kuruba,0,6,0,10,a s c p r o i u n
chlorine,1,4,0,13,a s e i t n c o h r y l
sabazianism,0,6,0,11,s e i n t o h u a c
doggone,0,6,0,8,a s e p c i r
exterraneous,1,5,0,15,s a c t e r n d l m p o u x
timberland,1,5,0,16,s a t r i n c e o d l p v m b
equational,0,6,0,14,s a n t i l o u p c m d b
scabriusculous,1,5,0,15,s t i e h u n l o c a r p b
noisomeness,0,6,0,11,s e i t p c u a m r
amueixa,0,6,0,10,a n l r t s m e d
wheen,0,6,0,9,a s e r n u p c
preacquit,0,6,0,10,s a n t m l c o h
reimposure,1,5,0,14,s i t p e h o c m u n l r
smelliness,1,2,0,9,s e n l i h t m
caber,0,6,0,10,a l n r t e g s p
civilizee,0,6,0,9,s a e m f p c o
royalism,0,6,0,12,a t n l e i s m p c d
pseudoaristocratic,1,1,0,13,s t i e r n a o c d u p
brawny,0,6,0,12,a r n i g u y w p e t
zoosis,0,6,0,10,a s i p m o c h r
degraded,0,6,0,11,a l r t n c e d p o
hydriote,0,6,0,11,a s e i n r t p c u
lockman,0,6,0,11,a n s m t e o r g b
darn,0,6,0,10,a t n i r b e p c
rejectingly,0,6,0,16,s a e r n l i y p d t g m c v
besottingly,0,6,0,15,s t i c n e a g r l y p m d
cocksurety,0,6,0,13,s t e i a o r n u l h m
handmaid,0,6,0,11,a l n g t s d i r c
culet,0,6,0,10,a s e r n d t u m
doormaking,0,6,0,15,s a t n i e g m d o l r b c
jugerum,0,6,0,9,a s e r i o n d
slunge,0,6,0,11,a s e t i o c u l d
unexplaining,0,6,0,13,s a t n e r i d o g l m
ornithogaea,1,5,0,15,s a p r e i n c t o m h l g
rebuffably,0,6,0,14,s a l e r o i d c b u f g
unsufficed,0,6,0,14,s t i n e r a c m u l d b
babuism,0,6,0,10,a l n t r c s i h
mnemonist,0,6,0,12,s e r t c a i g n d l
paver,0,6,0,11,a l n r t e g s p w
maimedness,0,6,0,13,s e r n d i l p c a t v
zonary,0,6,0,12,a t n l e s b r o y c
unbag,0,6,0,9,a l n r t c s m
incompensation,1,3,0,14,s t i n e a o r u l m p c
pavilion,0,6,0,13,a n r l i t c m p o b d
samson,0,6,0,10,a l n r t c s i u
blossomy,0,6,0,8,a s i c t p e
lenticulothalamic,1,3,0,15,s a l e r n i c o t h b u m
mayfowl,0,6,0,9,a l t r n u b p
superactive,1,5,0,16,s t i n e r a c h u l m d v p
solecistically,1,0,0,10,s t i a l y o c e
snivy,0,6,0,10,a s e t o i n p c
cobus,0,6,0,11,a s u c o p r m n g
triphylite,1,3,0,12,s a e p r o i h y t l
inclinatorium,1,5,0,16,s a t i n e o c l d r p v m u
wiglet,0,6,0,9,a s e r n d t p
overtness,1,5,0,13,s e r i h a o t n l m v
interrupted,0,6,0,14,s a e r o i n t d y m u c
curstful,0,6,0,12,a s t i e o u n l r q
hymenogeny,0,6,0,10,s a e r n t i g c
whipcord,0,6,0,12,a s e i n t c h o r y
gigi,0,6,0,8,a s e u o i t
lacing,1,3,0,10,a l n t c u e i g
plical,1,4,0,10,a n l e i c b u p
squabbed,0,6,0,10,a t n l r s e c i
phellogen,0,6,0,13,s a e r n p l i y o h m
potwaller,1,5,0,14,s a n t r c l p e i h o w
monophagism,0,6,0,15,s t e i a m o n r l u p h b
kawaka,0,6,0,8,a c r n m l b
disglorify,0,6,0,13,s t i e n a c o l d r p
polyclona,0,6,0,13,s a p i e o n r u l y b
capreolate,1,3,0,12,s a t e l c r b p d o
incurrent,1,2,0,10,s a e r c t u n i
delegalize,0,6,0,12,s a t n l e i r c d v
reboard,0,6,0,11,a t r e s o i y m c
refight,0,6,0,10,a s e r n l t d m
awakening,0,6,0,12,s a n t e i g l r c m
ineducable,0,6,0,15,s a l e p r n d i o u b m t
apoembryony,0,6,0,12,s a t l r i e n o d c
contrariwise,0,6,0,16,s e a t l n r i p c o d v m f
multinominal,0,6,0,14,s a l i c n t e p g o u r
shall,1,2,0,7,a s l t p h
superobstinate,1,3,0,15,s i c t e n r a o u l m p b
negrillo,0,6,0,13,a s e r i t n c o d l p
exaggerated,0,6,0,12,s a l n t i e r c d b
alcoholometrical,0,6,0,16,s a l e i o r n c m p t g d w
directional,1,4,0,15,s a l c i n t o d p v m r e
almemar,1,3,0,9,a n l o e t r m
loggia,0,6,0,9,a s c p r i m d
persistively,1,5,0,15,s i n c t a p o e r d l y v
unperilous,0,6,0,15,s u n o e l d b r t a g i c
iridectomy,0,6,0,13,s a e r o c t p n i l u
compassivity,0,6,0,13,s e i c o n t r a u l h
pettedness,1,3,0,10,s e r n d l a t p
heder,0,6,0,10,a s e r d c p t m
quinizarin,0,6,0,12,s a l r e i c n p u t
hemihedrally,0,6,0,14,s a l i o e r y t n d c v
settledly,1,5,0,12,s t e r n d i a o l y
dashedly,0,6,0,12,a n l e y r s m t p c
groset,0,6,0,11,a s e r c n d t i p
unsaintlike,0,6,0,15,s t e i p c a n r u v h l d
untransmissible,1,3,0,15,s t i e a c n o l h u r m b
anathematization,1,5,0,15,s a l n t i e r c h o m d z
benzamido,0,6,0,10,s a n t e l p r c
peonage,0,6,0,11,a t r l n p e d m c
thereamong,0,6,0,13,s a t i e r b h f l n c
underdot,1,4,0,12,a s e r i o n u t g d
intersociety,0,6,0,15,s t i e a o r h n y l m d p
infinitarily,1,5,0,14,s a t n e l i y r d g c f
scimitar,1,5,0,13,a n l r e s t i c d v m
torricellian,1,1,0,11,s a l c t i e r n o
mantissa,1,4,0,11,a r l n i c s t p m
winterfeed,0,6,0,11,s a e r p t d u c m
mercantile,1,5,0,15,s a n e t i d b c v p l r m
tup,0,6,0,8,a u n s m l b
xanthosiderite,0,6,0,17,s t i e a r o n c h p v m d b w
spasmatical,1,3,0,12,s t e i c o h a l m p
isocercy,0,6,0,13,a s i o n r e t m y l v
spotting,0,6,0,13,a s e i n t g h o l c m
dragging,1,4,0,11,a t l n c r e d i g
choriamb,1,5,0,14,a t r e c i n l o s b h m
deflagrate,0,6,0,13,s a n r t i e d l b p c
anchorwise,0,6,0,16,s e a n o t g r i d c h m l b
ophiolite,0,6,0,12,s a e i n t o r l u m
serventism,0,6,0,14,s e r t i h a c u o m n d
tunker,0,6,0,10,a s e r p t i o m
articulate,1,4,0,13,s a t i e n c o h r u l
penitencer,1,4,0,12,s a e r n t d g c p i
appercipient,0,6,0,14,s a t n c e l r o h i b m
itchproof,0,6,0,12,s a e c o r n u h p m
aptera,1,5,0,11,a n t i e r s c l p
cacodaemonial,0,6,0,14,s a l n t r c o m g i p u
intracity,0,6,0,12,s a n e i d g t r o h
tabet,0,6,0,9,a l n r t p c s
panting,0,6,0,11,a l n g i d k b c e
untrickable,1,3,0,15,s a l e b u n t i w c h r k
heinousness,0,6,0,13,s e n t i g a o p u m d
tamein,0,6,0,12,a l n r t e h d m o u
puzzlement,0,6,0,13,s a e r n t m c u l d b
countermanifesto,0,6,0,18,s t i e r a o n c u v d l m z g p
uniformity,0,6,0,14,s a e o n u t i r h y c d
angiomalacia,1,5,0,14,s a l n t e c i o r m d g
playground,0,6,0,15,s a t n i c e l g o d u r b
meatcutter,0,6,0,12,s a t i e r o h y u p
reascendant,1,2,0,11,s t i e r n a c g d
cogging,0,6,0,11,a s e u i n g p o b
guttering,1,5,0,13,s a e r i n g o l u m t
industrious,1,4,0,13,s t i n c a e o g d u r
unbalked,0,6,0,13,a t n l e d u c v p i g
uncuffed,0,6,0,11,a s e r n d i o u l
nonillionth,1,5,0,12,s a e c i n t o r h l
unhidable,0,6,0,14,s a l e b c r t u n i g f
macbeth,0,6,0,10,a l n t e i r g o
molassy,0,6,0,10,a t n l s p c i e
overchidden,1,5,0,15,s a e r o t l i n c d h m v
lyophilize,0,6,0,12,s a e p r o h i c t u
recreationist,1,2,0,12,s e t i n r a o d p c
needleful,0,6,0,11,s a e r n d l t m c
loiteringness,1,2,0,12,s e n d l i t r o a g
campmaster,1,3,0,12,s i e r a t l n m p c
reformingly,0,6,0,16,s a e r o m p i n t g l y c d
omnimodous,0,6,0,12,s u a o r n e t i c l
vaporiferous,0,6,0,16,s a l t n r e i o c p v u d z
subinform,0,6,0,14,s t e i n o a u r m l c d
tarsectomy,0,6,0,14,s t e i o r n u l m a p b
vacuity,0,6,0,12,a l n t e i r o u y g
thinglet,1,3,0,11,a s e r n t i g h l
unclotted,0,6,0,13,s a e r n d i t o u k g
doorweed,0,6,0,9,a s e r n p c t
unslumbrous,0,6,0,14,s e i t p c u n l r m o a
prefreshman,0,6,0,14,s e t r i p h o a l n d y
reassert,1,4,0,10,a t s c p i e n r
absenteeism,0,6,0,14,s e t p c i a h u o m n r
megalopic,0,6,0,15,s a n t l e i o c r m d p x
cocrucify,0,6,0,10,s a e c o h i n t
specialness,1,5,0,14,s e n r l t d a m c h i p
diphtheroid,0,6,0,13,s a e r i n c t o d l m
nonbodily,0,6,0,10,s a e c p i n o t
purplewort,0,6,0,13,s a e r i o p t h l n c
bequeathable,0,6,0,11,s a n r t l e d c m
mungy,0,6,0,10,a s e u n o i g r
scraggling,1,3,0,12,s t e i a n l g h c r
silicofluoric,0,6,0,14,s t e i n c o r l u p b g
marcella,1,4,0,11,a r i e s l c b p m
unnumerical,1,4,0,14,s a l c p i o t u n r m e
adenophyma,1,4,0,14,s a n e o r m d y u l p h
hypothesizer,0,6,0,15,s e t r p i c a u h n o v d
overpiteous,0,6,0,15,s a u o r e i n t m l v d h
bridewort,0,6,0,13,s a e r n o i t c p d u
guittonian,0,6,0,13,s a l n i c t p u e o q
propertied,1,3,0,11,s a e r o i n d p t
israeliteship,0,6,0,15,s t i n c a l o d e m p h u
babyfied,0,6,0,8,a n l t r c s
fratry,0,6,0,11,a r i e o t y p u c
nonthinker,0,6,0,14,s a e r o n i d t h g c v
classified,0,6,0,14,s e r c a n t i d h l v m
tornillo,1,4,0,11,a s e i c t r n o l
uncasketed,1,5,0,15,s t e r n a d u c h m p l k
melonlike,0,6,0,11,s a e r n t d i l c
frivolity,0,6,0,13,s a e c p i t o r l f j
morganatic,0,6,0,15,s a l t r i c m e o n d p b
octonarius,1,2,0,12,s u a t e c i r o m n
zaniah,0,6,0,9,a n c r t m s b
parapegma,0,6,0,10,s a l r m n t c b
dolichoprosopic,0,6,0,15,s e o n r u l i c h p m t b
pharynx,0,6,0,10,a l r e i o u h t
dosa,0,6,0,9,a p u s l c t m
hygrodeik,0,6,0,10,s a e r o c n p t
trigram,0,6,0,11,a n l r o t e i c s
helios,0,6,0,10,a s u i t c o p m
sesti,1,2,0,7,a s t i u e
suppositionally,0,6,0,16,s t i n e a l o y h c u r m b
clogmaker,0,6,0,12,s a l e t r i y o n u
gamogenetical,0,6,0,16,s a l n t i r c b p m e o v d
therapist,1,1,0,10,s e r o i p t h a
unannex,0,6,0,10,a l r n e s d t m
carboy,0,6,0,11,a l n r e i o c p t
satyagrahi,0,6,0,13,s t i e a l n r h p b c
underaverage,0,6,0,13,s a t l n r e d u c m b
xenopteri,0,6,0,14,s a e r n i t g o p m d c
bloodshedding,0,6,0,13,s t e r n a c d i p g u
academite,1,5,0,13,s a n l r m e i c d z t
apprehensibility,0,6,0,18,s t i e r h p o a n y d c l v m f
bombax,0,6,0,9,a n l r s t m i
feedy,0,6,0,10,a s e r t l d y w
sklate,0,6,0,10,a t e u p i c b r
ornithoptera,1,2,0,12,s a p r e i n c t o h
isagoge,0,6,0,9,a l r n s p t c
heterofermentative,0,6,0,16,s a t i e r o n v p m l d c g
unsleeved,1,3,0,11,s t e r n d u m l v
chevrotain,0,6,0,16,s a t n u p c o h e r i d g b
gasteromycete,0,6,0,16,s t i e r a o n m p b u y c h
hyperplasic,1,2,0,13,s e r i p h a n c o l y
greengrocery,0,6,0,11,s a e r o i n t m p
beshake,0,6,0,10,a t r l n s e p m
unguled,0,6,0,11,a s e r n d i o u m
aggregator,0,6,0,11,s a l t r e n c b m
persuaded,0,6,0,13,s e t r n i c a l d p h
cupola,0,6,0,10,a s c o h e t i r
roughness,0,6,0,13,s e a t p i c r o n u l
plemyrameter,0,6,0,13,s a t i o e r n p l d c
criminalness,0,6,0,15,s e a n t p c o h i l r d v
balanic,1,4,0,11,a t n c r l i p m b
burnishable,1,4,0,15,s e t c p i u n h o a l b r
unmindful,0,6,0,9,s a e c p i n g
sabino,0,6,0,10,a l n g e c s d t
underthane,1,3,0,12,s a t r n e i u g h d
olympicness,0,6,0,13,s e a u i t c p h m r d
catarrhal,0,6,0,12,s a n l t r m c i e d
wieldable,0,6,0,13,s a l i e b t p m d h r
outsuitor,1,4,0,11,s e a i c t r p u o
mohineyam,0,6,0,10,s a n e c t l r p
intervisit,0,6,0,13,s t e n a r i m d o l h
urotoxic,0,6,0,10,a s e i c o p n m
myelalgia,0,6,0,12,s a t l e i p c u m b
strophe,0,6,0,11,a s e t i r b c d f
ingraft,0,6,0,13,a t s p n e i g r c l u
misosophist,1,4,0,12,s t p h c u a i m e o
caumatic,1,5,0,12,a l r t i s n c b m u
unreckonable,1,5,0,16,s a l e n r t d c o h u b i k
epidermatous,1,4,0,16,s a t o u m p e h r i n v c d
shrimpfish,0,6,0,9,s e t a i c n o
keest,0,6,0,9,a s t u i r p c
eccrinology,0,6,0,12,s a e r o n l m t d u
unmiscible,1,4,0,14,s t e i m l b r p c a u n
unmoaned,0,6,0,11,a l r t n e s d i g
predestinationist,1,0,0,11,s e t i n p r a d o
cleavability,0,6,0,13,s a t i l e r o h u y n
earnings,0,6,0,13,a n o e t i g r l u h y
genal,0,6,0,9,a l s c r t u d
unjarring,0,6,0,13,s a n i g r u t c e d f
wottest,0,6,0,10,a s t p c u i e m
boryl,0,6,0,9,a s e u o r i d
rocklike,0,6,0,11,a s e i t n p c r v
fruitarianism,0,6,0,15,s e t i a p c u m l r n b o
guilelessness,0,6,0,11,s e p l m c t a u b
borstall,0,6,0,11,a t n l s y p c u m
hemitropic,1,4,0,14,s a e r o p t i n c d m h
trumph,1,5,0,12,a s e u n r m p h g t
mulattress,1,3,0,12,s e n r c t p a u m l
foamer,0,6,0,12,a r e s l p t m f b c
scientician,1,2,0,10,s t i n o a c u e
endophyllum,0,6,0,9,s a e r n t i g
shapeshifter,1,5,0,15,s t h o e i r a n l c m p f
nonbotanical,0,6,0,14,s a l t n e i o c g d f r
stenchful,0,6,0,11,s t e r n o i g a d
synentognathous,1,2,0,13,s e r n t i o u a h g y
branchiostoma,1,5,0,17,s e i a t r l n o g c h p m u b
correa,1,2,0,8,a s c o r i e
figshell,0,6,0,10,a s t e p i r n d
buffoonish,0,6,0,14,s e t i m h p n f u o q c
ooplast,0,6,0,11,a t s c u b f p h r
postfixial,0,6,0,14,s t i o a l p b r n h c d
impossibility,0,6,0,12,s i n c t e o a r l h
alalite,1,4,0,10,a n r t e s m l i
cozily,0,6,0,8,a s e u o n r
gitoxin,0,6,0,9,a s e u i n l p
organographic,1,4,0,14,s a n t p e o r h i c u g
suborganic,0,6,0,16,s t e i c o n u r a m l p b d
unattractableness,1,1,0,12,s e n i a l t r u b c
detrimentally,1,4,0,15,s a l i t e y n r c v d z m
betroth,0,6,0,10,a s e r i o d p n
chloralum,0,6,0,11,s a l i y e o p u n
neophilologist,1,5,0,16,s e t r l a i o n m u p h d g
tallote,0,6,0,11,a l i e c y o n r m
byrlawman,0,6,0,13,s a n r t c l p b e m o
ailanthic,1,2,0,10,s a n t i c r h l
prepatent,1,2,0,9,s a n t p e h r
accumulation,1,5,0,15,s a t i n r l c o h e u b m
cecidiology,0,6,0,11,s a e r n l i o m t
potamic,1,5,0,13,a t s l c r i o n p b m
unhesitatingly,0,6,0,17,s t i c n e a g r l y u d v k f
stolidity,1,5,0,13,s t i e a o r h n y l d
